Unnamed: 0.1,Text,Platform,Hashtags,Retweets,Likes,Country,Year,Month,Day,Hour,Sentiment
22, Productive day ticking off my to-do list.          ,1, #Productivity #WorkFromHome           ,1.2034081528217437,1.214353154782072, USA ,2023,1,21,16,214
222," Flipping through the pages of an old yearbook, nostalgia painting smiles and tears on my face. ",1, #Nostalgia #YearbookMemories            ,-1.3474454220784002,-1.27140330299331, India         ,2017,6,18,14,201
600,Embarked on a DIY home decor project. Let's hope it turns out better than last time. #DIYAdventure #TeenHomeDecor ,1, #DIYGoals #TeenCreative ,1.911978590294006,1.9245692855750383, UK,2023,6,8,16,110
717,Collaborating on a group project to promote teamwork and shared responsibilities. Group effort in action. ,0, #TeamSpirit #HighSchoolProjects ,-0.4971608971116855,-0.5611871722003436, USA,2023,10,14,17,196
418,Imbued with gratitude for the simple pleasure of a warm cup of tea. ,3, #Gratitude #WarmTea                    ,-0.4971608971116855,-0.5611871722003436, Japan           ,2023,2,15,8,131
612,"Joined a community choir, harmonizing with fellow voices. Music creates bonds that withstand time. #CommunityChoir #HarmonyInAging ",1, #MusicHarmony #SeniorVoices ,-0.2137327221227806,-0.20607910680386055, USA,2023,6,20,14,172
204," Embracing the ebb and flow of life, finding acceptance in the dance of existence. ",1, #Acceptance #LifeJourney                   ,-0.9223031595950428,-0.9162952375968269, UK           ,2023,1,10,16,1
449,"In the wasteland of lost trust, the echoes of broken promises reverberate. ",0, #Betrayal #ReverberatingPromises ,0.4948377153494816,0.5041370239891058, Italy ,2016,12,12,10,29
94, Bitter experience at the customer service department.   ,0, #BitterExperience #CustomerService         ,-0.4971608971116855,-0.5611871722003436, USA       ,2023,2,26,15,31
333,Awe-struck by the breathtaking sunrise over the mountains.      ,1, #Awe #BreathtakingSunrise                   ,0.9199799778328389,0.8592450893855889, USA               ,2022,4,3,6,27
383,A sense of wonder at the vastness of the cosmos on a stargazing night. ,1, #Wonder #StargazingAdventure            ,2.6205490277662684,2.6347854163680045, South Africa    ,2018,7,8,23,274
424,"Despair clouds the mind, feeling adrift in an endless sea of darkness. ",1, #Despair #EndlessDarkness               ,0.9199799778328389,0.8592450893855889, Australia        ,2016,5,15,22,73
285," With empathy as a lantern, wandering through the dark alleys of sorrow, illuminating the path with compassion and care. ",0, #Empathetic #LanternOfCompassion ,-0.7805890721005904,-0.7742520114382335, USA ,2023,9,3,21,94
185," Intimidation by the challenges ahead, fear takes hold.",3, #Intimidation #FacingFear                   ,-0.9223031595950428,-0.9162952375968269, India         ,2021,10,22,18,164
591,"Bought a new video game, played for hours, forgot to eat. The ultimate gaming session. #GamerLife #NoFoodGaming ",1, #GameOn #TeenGamer ,0.06969545286612429,0.1490289585926226, USA,2023,5,30,20,110
330," Dismissive gestures, a curtain drawn to shield the vulnerability, a stage where emotions take a backseat to the performance of indifference. ",1, #Dismissive #IndifferencePerformance ,-1.3474454220784002,-1.3424249160726065, Australia ,2018,8,18,14,85
154, Gratitude for the small joys that each day brings.   ,0, #Gratitude #SmallJoys                        ,-0.9223031595950428,-0.9162952375968269, Australia   ,2012,3,30,11,132
76, A moment of shame for not standing up against injustice. ,0, #Shame #Injustice                           ,-0.9223031595950428,-0.9162952375968269, India      ,2023,2,19,19,248
378,Pensive contemplation amid the ancient ruins of a forgotten civilization. ,3, #Pensive #AncientCivilization           ,-0.4971608971116855,-0.5611871722003436, Greece           ,2023,4,18,17,210
278," Charting a course through the waves of hopeful anticipation, a sailor steering towards the shores of dreams yet unexplored. ",2, #Hopeful #SailorOfDreams ,-0.6388749846061379,-0.6322087852796403, Australia ,2022,10,30,11,152
69, Anticipating a thrilling adventure in the coming weeks. ,1, #Anticipation #Adventure                    ,-0.2137327221227806,-0.20607910680386055,USA,2023,2,17,7,16
672,Creating a secret handshake with friends. Friendship level: Expert! ,0, #FriendshipGoals #HighSchoolMemories ,-0.2137327221227806,-0.20607910680386055, USA,2023,8,30,17,172
189, Disgust at the corruption that stains society.     ,1, #Disgust #Corruption                        ,-2.056015859550662,-1.9816194337862763, UK            ,2016,7,1,9,84
272," A free spirit soaring on the wings of dreams, leaving trails of independence in the azure sky of boundless possibilities. ",2, #FreeSpirit #WingsOfDreams ,0.06969545286612429,0.07800734551332597, UK ,2020,6,10,10,118
237," Drifting through the day with an air of nonchalance, indifferent to the trivialities of life. ",0, #Indifference #DriftingThroughLife       ,-1.7725876845617574,-1.7685545945483863, India         ,2023,2,22,17,158
89, Disappointed with the lack of progress in a personal project. ,3, #Disappointed #Project                     ,-0.4971608971116855,-0.5611871722003436, India      ,2023,2,25,9,80
621,"Attended a jazz concert and swayed to the rhythm of timeless tunes. Music, a constant companion in the golden years. #JazzConcert #SeniorMusic ",1, #TimelessTunes #SeniorJazz ,0.4948377153494816,0.5041370239891058, USA,2023,6,29,16,172
118," A moment of tenderness, connecting with loved ones.    ",0, #Tenderness #FamilyTime                       ,0.4948377153494816,0.5041370239891058, UK          ,2016,2,23,19,261
126, Serenity found in the pages of a favorite book.        ,1, #Serenity #BookTime                           ,0.06969545286612429,0.1490289585926226, UK          ,2011,9,22,19,245
697,Feeling a sense of emptiness after a close friend moves away. Farewells are always sad. ,1, #SayingGoodbye #HighSchoolEmotions ,-0.07201863462832815,-0.06403588064526729, Canada,2023,9,24,17,239
290," Playfully juggling responsibilities, a circus performer balancing the acts of work and joy, tossing laughter into the air. ",1, #Playful #JugglingResponsibilities ,0.4948377153494816,0.5041370239891058, USA ,2019,11,18,15,211
239," Wrapped in the cloak of emotional numbness, a shield against the storms of life's turbulence. ",1, #Numbness #EmotionalStorms               ,-1.630873597067305,-1.6265113683897932, Canada        ,2021,11,30,15,203
0, Enjoying a beautiful day at the park!              ,3, #Nature #Park                            ,-0.9223031595950428,-0.9162952375968269, USA      ,2023,1,15,12,214
724,Receiving a heartfelt letter from a pen pal in another country. Connecting across the globe! ,0, #GlobalFriendship #HighSchoolCorrespondence ,0.21140954036057674,0.1490289585926226, Canada,2023,10,21,17,139
362,Enthusiasm for learning new skills and expanding knowledge.      ,3, #Enthusiasm #SkillBuilding               ,1.2034081528217437,1.214353154782072, India             ,2018,8,7,12,102
638,"Hosted a 'memory lane' evening with old friends, reminiscing about the adventures that shaped our lives. #MemoryLane #SeniorReminiscing ",1, #FriendshipAdventures #SeniorNostalgia ,1.2034081528217437,1.214353154782072, USA,2023,7,16,14,128
666,Planning a surprise scavenger hunt for friends. Anticipating the thrill and excitement! ,1, #SurpriseAdventure #HighSchoolFun ,-0.2137327221227806,-0.3481223329624538, UK,2023,8,24,18,110
279," A compassionate rain, tears of empathy falling gently, nurturing the seeds of kindness in the garden of human connections. ",1, #Compassionate #TearsOfEmpathy ,-0.07201863462832815,-0.06403588064526729, Canada ,2021,7,1,12,48
117, Compassion in action: supporting a local charity event. ,1, #Compassion #CharityEvent                   ,-0.4971608971116855,-0.5611871722003436, Canada ,2015,7,18,14,47
229," An impenetrable numbness shields me from the emotional storms, a fortress of stoic resilience. ",3, #Numbness #StoicResilience               ,-1.4891595095728525,-1.4844681422311998, UK            ,2019,10,18,14,203
350,Contemplating life's mysteries under the starry night sky.         ,3, #Contemplation #StarryNight               ,0.9199799778328389,0.8592450893855889, UK                ,2016,7,2,23,55
364,A sense of accomplishment after completing a challenging workout.,0, #Accomplishment #FitnessSuccess         ,0.06969545286612429,0.1490289585926226, Australia          ,2022,6,30,7,2
275," Hopeful whispers of wind, carrying the promises of a brighter tomorrow, a symphony of optimism in the air of possibilities. ",2, #Hopeful #BrighterTomorrows ,-0.9223031595950428,-0.9162952375968269, India ,2023,5,6,7,152
319," Despair like a heavy fog, enveloping every thought, blurring the path ahead, a journey in the labyrinth of utter hopelessness. ",0, #Despair #LabyrinthOfHopelessness ,-1.9143017720562099,-1.9105978207069796, Canada ,2022,2,28,21,72
496,"In the embrace of the Grand Canyon, nature's masterpiece, a moment to marvel at Earth's grandeur. ",1, #Awe #EarthsGrandeur ,0.4948377153494816,0.5041370239891058, USA ,2020,6,15,16,24
145, Tenderness in a heartfelt message to a loved one.    ,0, #Tenderness #LoveNote                         ,0.4948377153494816,0.5041370239891058, UK          ,2016,12,25,19,261
431,"Soul-crushing disappointment, hopes shattered like fragile glass. ",3, #Disappointment #CrushedHopes          ,-0.2137327221227806,-0.20607910680386055, Spain        ,2019,10,8,18,81
423,"Tears fall like raindrops, mourning the end of a cherished friendship. ",0, #Grief #LostFriendship                  ,0.06969545286612429,0.1490289585926226, UK              ,2020,11,28,14,134
714,Participating in a science fair to showcase a unique experiment. Sharing knowledge with peers. ,0, #ScienceFair #HighSchoolScience ,-0.355446809617233,-0.4191439460417504, USA,2023,10,11,16,196
534,"At the film festival, the indie filmmaker's creation receives a standing ovation, evoking pride and a sense of accomplishment. ",2, #Pride #IndieFilmSuccess ,0.06969545286612429,0.1490289585926226, Australia ,2017,9,18,21,217
269," Floating on clouds of inspiration, an artist painting the sky with strokes of creativity, creating a masterpiece of dreams. ",2, #Inspired #CloudsOfCreativity ,-0.4971608971116855,-0.49016555912104703, India ,2021,12,8,14,163
517,"At a Michael Jackson tribute show, moonwalking through the hits, a celebration of the King of Pop. ",1, #Celebration #MJTribute ,0.4948377153494816,0.5041370239891058, USA ,2022,1,15,21,41
308," Dismissive glances, a fortress built with indifference, walls impenetrable to the pleas of understanding and recognition. ",2, #Dismissive #ImpenetrableWalls ,-1.0640172470894953,-1.05833846375542, UK ,2018,5,10,14,85
311," Fearful whispers in the dark, the mind haunted by the specter of the unknown, shadows dancing to the rhythm of anxiety's tune. ",2, #Fearful #SpecterOfTheUnknown ,-1.2057313345839478,-1.2003816899140134, UK ,2023,7,14,23,116
47, Attending a virtual reality meetup.                ,3, #VRMeetup #VirtualReality               ,0.9199799778328389,0.8592450893855889, India    ,2023,1,30,18,214
262," In the embrace of the autumn breeze, leaves of ambivalence dancing in a waltz between choices and uncertainties. ",0, #Ambivalence #AutumnWaltz ,-1.0640172470894953,-1.05833846375542, UK ,2019,9,14,10,11
196," Boredom lingers, a stagnant pool of indifference.  ",0, #Boredom #Stagnation                        ,-2.056015859550662,-1.9816194337862763, Canada        ,2021,10,2,19,36
732,"Organizing a virtual talent show during challenging times, bringing smiles to classmates' faces! ",1, #VirtualEntertainment #HighSchoolPositivity ,0.35312362785502915,0.2910721847512159, USA,2020,11,15,15,139
725,Creating a beautiful mural with fellow art enthusiasts. The power of collaboration and creativity! ,1, #ArtCollaboration #HighSchoolCreativity ,0.06969545286612429,0.006985732434029342, UK,2023,10,22,20,139
108, Pride in accomplishing personal and professional goals.  ,1, #Pride #Accomplishments                     ,-1.3474454220784002,-1.27140330299331, Canada ,2023,3,3,14,218
60, An amusing incident brightened up my day!               ,1, #Amusement #FunTimes                         ,-0.4971608971116855,-0.5611871722003436, UK           ,2023,2,14,14,13
548,"Experiencing the thrill of a high-speed Formula 1 race, fans are on the edge of their seats as drivers compete for the championship. ",2, #Thrill #Formula1Championship ,0.9199799778328389,0.8592450893855889, Germany ,2019,11,24,19,262
434,"Melancholy lingers, a bittersweet serenade in the quietude of solitude. ",2, #Melancholy #QuietSerenade             ,-0.4971608971116855,-0.5611871722003436, UK         ,2017,3,12,23,186
101, Reflecting on the beauty of diversity in our world.     ,3, #Acceptance #Diversity                      ,0.06969545286612429,0.1490289585926226, Australia ,2023,3,1,10,0
465,"Sinking in the quicksand of despair, the harder you fight, the deeper you descend. ",2, #Despair #DeepDescent ,-0.2137327221227806,-0.20607910680386055, USA ,2016,10,18,19,72
655,Got my hands on the latest fantasy novel. Diving into realms of magic and adventure! ,1, #FantasyBookNerd #HighSchoolReader ,1.911978590294006,1.9245692855750383, UK,2023,8,13,20,110
532,"As the credits roll, a profound sense of nostalgia washes over, reminiscent of cherished moments in classic films. ",1, #Nostalgia #ClassicFilmMoments ,1.911978590294006,1.9245692855750383, UK ,2019,6,25,22,198
629,"Started a book club for seniors, where discussions are as lively as the characters in the novels. #BookClub #SeniorReaders ",1, #BookishTalks #SeniorBookworms ,0.06969545286612429,0.1490289585926226, UK,2023,7,7,19,172
180," Jealousy gnaws at my confidence, a toxic emotion.  ",1, #Jealousy #Insecurity                       ,-1.9143017720562099,-1.9816194337862763, India         ,2018,6,3,16,170
305," Devastated by the storm of betrayal, the wreckage of trust scattered like debris, a heart torn by the winds of broken promises. ",2, #Devastated #WindsOfBrokenPromises ,0.4948377153494816,0.5041370239891058, Australia ,2022,8,3,15,79
573,"As the first snowflake descends, the winter enthusiast eagerly prepares for a season of frosty delights, anticipating the magic of snow-covered landscapes. ",0, #WinterMagic #SnowyLandscapes ,1.2034081528217437,1.214353154782072, Canada ,2022,12,1,17,272
397,Whimsical delight in a world of whimsical fairy tales.             ,1, #Whimsy #FairyTaleMagic                 ,-0.2137327221227806,-0.20607910680386055, USA             ,2016,3,8,14,270
704,Missing out on a long-anticipated event due to unexpected circumstances. A day filled with sadness. ,0, #MissedMoments #HighSchoolRegret ,-0.2137327221227806,-0.27710071988315715, UK,2023,10,1,14,239
150, Elation after achieving a fitness milestone.         ,1, #Elation #FitnessMilestone                   ,0.4948377153494816,0.5041370239891058, UK           ,2019,6,15,10,89
125, Contentment in the simplicity of a quiet Sunday.       ,3, #Contentment #SundayMood                      ,1.2034081528217437,1.214353154782072, Australia ,2010,8,15,10,57
579,"As the waves crash against the shore, the surfer embraces the thrill of riding the ocean's energy, capturing the essence of freedom in each wave. ",0, #OceansFreedom #SurfingThrills ,0.06969545286612429,0.1490289585926226, Brazil ,2021,7,20,18,205
636,"Started learning ballroom dancing, gliding gracefully across the dance floor. Ageless elegance in every step. #BallroomDancing #SeniorDancer ",2, #GracefulMoves #SeniorDance ,-0.2137327221227806,-0.20607910680386055, USA,2023,7,14,16,172
186," Helplessness engulfs me, drowning in a sea of problems.",1, #Helplessness #Struggling                   ,-1.9143017720562099,-1.9816194337862763, Australia    ,2019,5,8,14,148
480,"In the garden of friendships, each bloom a testament to the beauty of camaraderie. ",1, #Friendship #CamaraderieBlooms ,1.2034081528217437,1.214353154782072, South Africa ,2018,8,28,16,120
444,"A soul adrift in the sea of solitude, waves of loneliness crashing relentlessly. ",2, #Loneliness #CrashingWaves ,0.06969545286612429,0.1490289585926226, UK ,2016,6,28,14,178
716,Volunteering at a local charity event to give back to the community. Contributing to social causes. ,1, #CommunityService #HighSchoolVolunteer ,-0.2137327221227806,-0.27710071988315715, UK,2023,10,13,12,196
722,"Exploring a new hiking trail with friends over the weekend. Nature, laughter, and good vibes! ",1, #NatureAdventures #HighSchoolFriends ,-0.07201863462832815,-0.06403588064526729, UK,2023,10,19,18,139
391,Captivated by the ethereal beauty of a field filled with fireflies. ,1, #Enchantment #FireflyField              ,0.4948377153494816,0.5041370239891058, Brazil           ,2022,8,10,22,97
322," Yearning for the warmth of a vanished sun, a heartache painted in the hues of a sunset that never graced the horizon. ",0, #Yearning #HuesOfSunset ,-1.630873597067305,-1.6265113683897932, Australia ,2020,4,18,16,277
354,Feeling blessed for the supportive community in times of need.    ,1, #Blessed #SupportiveCommunity            ,-0.4971608971116855,-0.5611871722003436, UK                ,2021,9,10,9,34
675,Accidentally sent a love letter to the wrong person. Love note fail: Maximum embarrassment! ,0, #LoveLetterFail #HighSchoolAwkward ,-0.6388749846061379,-0.703230398358937, USA,2023,9,2,18,91
143, Empowerment through mentoring and guiding others.    ,3, #Empowerment #Mentorship                      ,-0.9223031595950428,-0.9162952375968269, UK       ,2014,6,3,8,95
142, Hopeful about the prospects of a new business venture.,0, #Hope #BusinessVenture                        ,0.06969545286612429,0.1490289585926226, Canada    ,2017,12,8,19,151
667,Danced in the rain to celebrate the end of exams. Rain dance: Unexpectedly refreshing! ,0, #RainDance #HighSchoolJoy ,0.4948377153494816,0.5041370239891058, Canada,2023,8,25,14,172
321," Loneliness, a solitary moon in a starless sky, casting a cold glow on the landscape of isolation, where echoes bounce in empty spaces. ",1, #Loneliness #StarlessSky ,-0.4971608971116855,-0.49016555912104703, USA ,2017,12,1,18,178
19, Winter blues got me feeling low.                   ,1, #WinterBlues #Mood                      ,-1.9143017720562099,-1.9816194337862763, USA       ,2023,1,20,15,195
173, Helplessness sinks in as challenges pile up.       ,3, #Helplessness #Overwhelmed                    ,-1.9143017720562099,-1.9816194337862763, Australia    ,2020,6,20,14,149
595,Spent hours creating the perfect playlist for every mood. Music is my therapy. #PlaylistMaker #TeenMusicLover ,0, #MusicTherapy #TeenPlaylist ,0.06969545286612429,0.1490289585926226, Canada,2023,6,3,21,172
313," Overwhelmed by the cacophony of expectations, a drowning soul in the tempest of pressure, struggling to stay afloat. ",0, #Overwhelmed #DrowningSoul ,-0.2137327221227806,-0.20607910680386055, USA ,2021,11,29,8,208
681,Building a time capsule to capture memories for the future. Time-traveling emotions! ,0, #TimeCapsule #HighSchoolNostalgia ,0.6365518028439341,0.3620937978305125, Canada,2023,9,8,14,172
12, Exploring the city's hidden gems.                  ,0, #CityExplore #HiddenGems                ,-1.3474454220784002,-1.27140330299331, UK       ,2023,1,18,14,214
306," Frustrated fingers tapping on the keyboard, a symphony of annoyance composing an unsolvable puzzle of unmet expectations. ",1, #Frustrated #UnsolvablePuzzle ,-1.3474454220784002,-1.3424249160726065, India ,2020,12,17,9,121
355,Captivated by the serenity of a tranquil garden in full bloom.     ,0, #Serenity #TranquilGarden                ,0.06969545286612429,0.1490289585926226, Canada            ,2018,5,12,14,245
25, Sunday brunch with friends.                        ,1, #Brunch #Friends                       ,-0.9223031595950428,-0.9162952375968269, UK ,2023,1,22,12,214
546,"Cheering for the underdog in the basketball finals, the crowd erupts in applause as the team defies odds to claim the championship title. ",0, #Triumph #BasketballFinals ,-0.4971608971116855,-0.5611871722003436, USA ,2022,6,20,21,268
170," Boredom sets in, the day feels endlessly dull.     ",3, #Boredom #LackOfInterest                     ,-1.9143017720562099,-1.9816194337862763, Canada        ,2016,9,28,19,36
39, Trying out a new dessert recipe.                   ,0, #Dessert #Cooking                      ,-1.3474454220784002,-1.27140330299331, Canada ,2023,1,27,16,214
454,"Sinking like autumn leaves in the river of sorrow, carried away by the current. ",1, #Sorrow #AutumnLeaves ,0.06969545286612429,0.1490289585926226, Canada ,2020,9,15,18,251
246," Fueled by curiosity, venturing into uncharted realms, a fearless explorer of the mysteries of the world. ",0, #Curiosity #FearlessExplorer              ,0.06969545286612429,0.07800734551332597, India         ,2022,12,1,9,68
299," Wandering through the desert of loneliness, each step a heavy sigh, mirages of connection shimmering but never materializing. ",2, #Loneliness #MiragesOfConnection ,-0.9223031595950428,-0.9162952375968269, USA ,2017,7,20,11,178
487,"Like a comet of inspiration, streaking through the sky of creativity, leaving trails of brilliance. ",2, #Inspiration #BrilliantTrails ,-0.4971608971116855,-0.5611871722003436, France ,2020,5,28,16,160
273," Bathed in the golden hues of gratefulness, a sunset of appreciation casting its warm glow on the landscapes of the heart. ",1, #Grateful #GoldenHues ,-0.355446809617233,-0.3481223329624538, Australia ,2022,4,1,18,127
559,"The weightlifter's failed attempt at a personal record results in frustration, highlighting the challenging nature of pushing physical limits. ",0, #Challenge #WeightliftingFailure ,1.911978590294006,1.9245692855750383, Germany ,2022,1,8,21,43
155, Hopeful about the potential for personal growth.      ,3, #Hope #PersonalDevelopment                    ,-0.4971608971116855,-0.5611871722003436, UK       ,2013,10,5,16,151
127, Gratitude for the support received during tough times. ,0, #Gratitude #Supportive                        ,-0.9223031595950428,-0.9162952375968269, India     ,2012,3,10,8,132
640,"Attended a local jazz festival, tapping toes to the tunes that have stood the test of time. Music, a lifelong love affair. #JazzFestival #SeniorMusicLover ",0, #TimelessTunes #SeniorJazz ,0.4948377153494816,0.5041370239891058, USA,2023,7,18,16,172
342,Curiosity sparked by exploring a mysterious ancient ruin.      ,0, #Curiosity #AncientDiscovery          ,-0.4971608971116855,-0.5611871722003436, Greece            ,2016,8,22,15,67
288," Confident strides in the dance of life, a ballroom where self-assuredness leads, twirling through challenges with grace. ",0, #Confident #DanceOfLife ,0.21140954036057674,0.22005057167191922, Canada ,2021,1,15,13,50
114, Overflowing with gratitude for life's blessings.      ,1, #Gratitude #Blessed                            ,1.2034081528217437,1.214353154782072, Australia   ,2012,11,25,10,132
520,"Experiencing the magic of a Coldplay concert, where 'Fix You' becomes a beacon of hope in the night. ",1, #Hope #ColdplayMagic ,1.2034081528217437,1.214353154782072, UK ,2016,11,28,19,150
174, Envy eats away at me as I see others' prosperity.  ,1, #Envy #Desire                                ,-1.630873597067305,-1.6265113683897932, Canada        ,2018,11,7,11,105
360,Confidence soars after overcoming public speaking anxiety.       ,1, #Confidence #OvercomingAnxiety          ,-0.9223031595950428,-0.9162952375968269, USA               ,2020,4,2,17,49
529,"In the crowd of an Ariana Grande concert, the high notes of 'Into You' create a euphoric symphony. ",0, #Euphoria #ArianaGrande ,1.911978590294006,1.9245692855750383, USA ,2023,1,22,20,106
58, Laughter is the best medicine—enjoying a comedy show. ,0, #Joy #ComedyShow                             ,0.06969545286612429,0.1490289585926226, Canada    ,2023,2,13,19,173
693,Caught in a torrential rainstorm without an umbrella. Today's weather is just bad luck. ,2, #BadLuck #HighSchoolWeather ,-0.4971608971116855,-0.5611871722003436, USA,2023,9,20,12,28
223," Torn between opposing emotions, an ambivalence that colors my decisions with shades of uncertainty. ",0, #Ambivalence #ShadesOfUncertainty       ,-0.9223031595950428,-0.9162952375968269, Australia    ,2022,7,8,11,12
281," Embraced by the hopeful dawn, a gardener sowing seeds of optimism, tending to the blooms of a brighter tomorrow. ",1, #Hopeful #SeedsOfOptimism ,-1.0640172470894953,-1.05833846375542, UK ,2022,7,17,6,152
17, Late-night gaming session with friends.            ,3, #Gaming #LateNight                      ,-0.4971608971116855,-0.5611871722003436, UK       ,2023,1,20,0,214
628,"Visited an art gallery, appreciating the brushstrokes that tell tales of creativity. Art, an eternal companion. #ArtGallery #SeniorArtLover ",0, #CreativeExpressions #SeniorArt ,0.4948377153494816,0.5041370239891058, USA,2023,7,6,14,172
323," Fearful eyes scanning the shadows, a prisoner of the night, terrorized by the lurking monsters born from the mind's darkest corners. ",2, #Fearful #LurkingMonsters ,-0.4971608971116855,-0.49016555912104703, India ,2023,1,7,3,116
256," Soaring on the wings of a free spirit, unburdened by the chains of conformity, painting the sky with independence. ",1, #FreeSpirit #PaintingTheSky ,-0.2137327221227806,-0.20607910680386055, India ,2021,8,15,11,118
468,"Whispers of lost love linger in the attic of the heart, forgotten but not erased. ",2, #Loss #ForgottenLove ,0.06969545286612429,0.1490289585926226, Australia ,2019,9,10,21,181
702,Experiencing hate comments for expressing personal opinions. Online negativity prevails. ,2, #OnlineOpinions #HighSchoolCriticism ,0.35312362785502915,0.3620937978305125, USA,2023,9,29,15,143
