Unnamed: 0.1,Text,Platform,Hashtags,Retweets,Likes,Country,Year,Month,Day,Hour,Sentiment
698,Facing rejection from a dream college. Disheartened but determined to explore other paths. ,0, #CollegeDreams #HighSchoolJourney ,-0.355446809617233,-0.4191439460417504, UK,2023,9,25,20,239
198," Lost in the vast sea of information, an indifferent wave in the digital ocean. ",1, #Indifference #DigitalOverload              ,-2.056015859550662,-1.9816194337862763, Canada          ,2022,11,28,17,158
280," Proudly scaling the peaks of achievement, a mountaineer conquering challenges and planting the flag of success. ",2, #Proud #ScalingPeaks ,0.21140954036057674,0.22005057167191922, USA ,2020,1,5,8,220
294," Proudly scaling the peaks of achievement, a mountaineer conquering challenges and planting the flag of success. ",2, #Proud #ScalingPeaks ,0.21140954036057674,0.22005057167191922, USA ,2020,1,5,8,220
401,A burst of artistic creativity in the quietude of an artist's studio. ,3, #ArtisticBurst #StudioCreativity       ,-0.9223031595950428,-0.9162952375968269, Italy           ,2015,9,1,16,23
123, Elation after a surprise reunion with old friends.    ,1, #Elation #OldFriends                          ,0.4948377153494816,0.5041370239891058, Canada      ,2020,4,2,9,89
184," Anxiety grips my chest, a relentless grip on my thoughts.",0, #Anxiety #Restlessness                      ,-1.630873597067305,-1.6265113683897932, UK            ,2018,9,5,9,18
203," Torn between conflicting emotions, an ambivalence that paints my decisions in shades of uncertainty. ",3, #Ambivalence #UncertainChoices             ,-1.3474454220784002,-1.27140330299331, Canada        ,2022,5,30,11,12
439,"Desperation whispers, the silent plea for a glimmer of hope in the abyss. ",1, #Desperation #GlimmerOfHope            ,0.06969545286612429,0.1490289585926226, France    ,2019,4,30,14,76
247,"Wrapped in the cloak of emotional numbness, a shield against the storms of life's turbulence. ",1, #Numbness #EmotionalStorms ,-1.630873597067305,-1.6265113683897932, Canada ,2021,11,30,15,202
416,Drenched in nostalgia while flipping through an old family photo album. ,1, #Nostalgia #FamilyPhotoAlbum           ,0.4948377153494816,0.5041370239891058, India          ,2016,12,5,21,198
649,"Accidentally spilled paint in art class. Abstract art, right? #ArtClassAdventures #HighSchoolArtist ",1, #ArtisticMishaps #HighSchoolArt ,0.06969545286612429,0.1490289585926226, UK,2023,8,7,19,91
130, Compassion towards those in need during the holidays.  ,0, #Compassion #HolidaySupport                   ,-0.4971608971116855,-0.5611871722003436, USA      ,2015,12,22,14,47
403,Awe-inspired by the vastness of the cosmos on a stargazing night.   ,1, #Wonder #StargazingAdventure            ,2.6205490277662684,2.6347854163680045, South Africa    ,2018,7,8,23,275
577,"Engulfed in the aroma of freshly brewed coffee, the writer finds inspiration in every sip, embarking on a journey of creativity and prose. ",2, #CreativeInspiration #CoffeeJourney ,0.06969545286612429,0.1490289585926226, France ,2023,2,12,19,59
569,"In the realm of literature, a captivating novel transports the reader to distant lands, weaving a tapestry of imagination and escape. ",0, #Imagination #LiteraryEscape ,1.911978590294006,1.9245692855750383, Japan ,2021,10,8,20,155
220," Immersed in a state of emotional numbness, a shield against the storm of daily struggles. ",0, #Numbness #EmotionalShield               ,-1.630873597067305,-1.6265113683897932, USA          ,2021,12,1,15,203
665,Hiding a snack stash in my backpack for emergency cravings. Snack ninja mode: Activated! ,2, #SnackNinja #HighSchoolSnacks ,0.9199799778328389,0.8592450893855889, USA,2023,8,23,16,192
589,"Staring at the clock in class, waiting for the bell to ring like it's the most exciting event of the day. #ClassCountdown #TeenLife ",0, #ClassEvent #TeenExcitement ,-0.4971608971116855,-0.5611871722003436, USA,2023,5,28,12,256
668,Accidentally sent a text meant for a friend to the class group chat. Texting fail: Oops moment! ,2, #TextingFail #HighSchoolAwkward ,-0.4971608971116855,-0.5611871722003436, USA,2023,8,26,17,91
602,Started a blog about random thoughts and musings. Blogging is the new diary. #BloggerLife #TeenBlogger ,2, #BloggingJourney #TeenThoughts ,1.2034081528217437,1.214353154782072, Canada,2023,6,10,17,64
387,Heartfelt gratitude for the laughter shared during a family reunion. ,0, #Gratitude #FamilyLaughter              ,0.06969545286612429,0.1490289585926226, Austria         ,2017,12,28,19,129
709,Collaborating on a school project with peers. Teamwork makes the dream work. ,2, #Teamwork #HighSchoolProjects ,-0.4971608971116855,-0.49016555912104703, Canada,2023,10,6,17,196
510,"Cruising the fjords of Norway, each icy landscape a breathtaking masterpiece of nature's grandeur. ",1, #Grandeur #IcyMasterpiece ,0.06969545286612429,0.1490289585926226, Norway ,2018,5,28,18,126
268," A playful escapade in the carnival of life, carousel laughter and cotton candy dreams swirling in the joyous atmosphere. ",0, #Playful #CarnivalEscapade ,0.35312362785502915,0.3620937978305125, Australia ,2018,8,22,17,211
442,"Avoiding the thorns of regret, walking barefoot on the path of remorse. ",1, #Regret #PathOfRemorse ,0.4948377153494816,0.5041370239891058, Canada ,2022,4,18,11,225
497,"Journeying through the serenity of Santorini, where each sunset paints the sky with hues of tranquility. ",0, #Serenity #SunsetHues ,0.06969545286612429,0.1490289585926226, Greece ,2016,9,10,19,243
113," Meditating by the serene lake, finding inner peace.   ",3, #Serenity #Meditation                          ,-0.4971608971116855,-0.5611871722003436, UK          ,2022,2,12,18,245
233," Embracing imperfections, finding acceptance in the mosaic of life's beautiful chaos. ",1, #Acceptance #BeautifulChaos              ,-0.4971608971116855,-0.49016555912104703, Australia     ,2021,7,20,16,1
637,"Organized a community painting event, turning blank canvases into a masterpiece of shared creativity. #PaintingEvent #SeniorArtist ",0, #CommunityArt #SeniorCreativity ,0.9199799778328389,0.8592450893855889, Canada,2023,7,15,19,172
374,Enveloped in serenity while practicing mindfulness by the lake.    ,1, #Mindfulness #LakeTranquility            ,1.911978590294006,1.9245692855750383, Canada           ,2017,10,20,8,190
234," Determination as the driving force, propelling me forward on the path to extraordinary achievements. ",0, #Determination #ExtraordinaryPath        ,-0.2137327221227806,-0.20607910680386055, USA          ,2019,12,3,13,78
590,"Discovered a new book series and spent the whole night reading. Who needs sleep, anyway? #BookwormLife #LateNightReading ",2, #BookDiscoveries #TeenReading ,1.2034081528217437,1.214353154782072, UK,2023,5,29,23,172
318," Dismissive gestures, a curtain drawn to shield the vulnerability, a stage where emotions take a backseat to the performance of indifference. ",1, #Dismissive #IndifferencePerformance ,-1.3474454220784002,-1.3424249160726065, Australia ,2018,8,18,14,85
411,Curiosity awakened by the mysteries of an ancient archaeological site. ,1, #Curiosity #AncientMysteries          ,-0.4971608971116855,-0.5611871722003436, Australia ,2015,11,8,10,65
654,"Joined the drama club to unleash my inner actor. Lights, camera, action! ",0, #DramaClubStar #HighSchoolActor ,0.4948377153494816,0.5041370239891058, USA,2023,8,12,13,110
359,Appreciation for the vibrant culture experienced during travel.   ,3, #Appreciation #CulturalExperience        ,0.9199799778328389,0.8592450893855889, UK                ,2016,11,14,13,20
259," Striding with confidence, footprints of self-assuredness imprinted on the sands of challenges conquered and victories claimed. ",1, #Confident #FootprintsOfAssuredness ,0.4948377153494816,0.5041370239891058, Australia ,2022,2,15,13,50
283," Floating on clouds of inspiration, an artist painting the sky with strokes of creativity, creating a masterpiece of dreams. ",2, #Inspired #CloudsOfCreativity ,-0.4971608971116855,-0.49016555912104703, India ,2021,12,8,14,163
377,Whimsical delight in a world of fairy tales and magical creatures.  ,1, #Whimsy #MagicalWorld                    ,-0.2137327221227806,-0.20607910680386055, USA             ,2016,3,8,14,270
385,Whispers of inspiration from the rustling leaves in a serene forest. ,0, #Inspiration #ForestWhispers            ,0.9199799778328389,0.8592450893855889, Portugal        ,2016,11,15,11,160
225," A fiery determination burning within, fueled by the vision of reaching unparalleled heights. ",1, #Determination #UnparalleledHeights      ,-0.2137327221227806,-0.20607910680386055, UK            ,2021,9,10,14,78
695,Dealing with unfounded rumors circulating about personal life. Rumors can be hurtful. ,0, #RumorMills #HighSchoolDrama ,0.21140954036057674,0.22005057167191922, UK,2023,9,22,18,143
598,Attended a concert and danced the night away. Music is the heartbeat of life. #ConcertVibes #DanceAllNight ,0, #MusicMagic #TeenConcert ,0.9199799778328389,0.8592450893855889, Canada,2023,6,6,22,172
473,"In the garden of contentment, each bloom whispers tales of inner peace and joy. ",0, #Contentment #InnerPeace ,0.4948377153494816,0.5041370239891058, UK ,2022,2,15,12,56
348,Feeling empowered after conquering a challenging hiking trail.     ,1, #Empowerment #HikingAdventure             ,1.911978590294006,1.9245692855750383, USA               ,2018,9,5,14,95
506,"At the summit of Mount Fuji, a breathtaking sunrise that paints the sky with hues of accomplishment. ",0, #Accomplishment #SunriseHues ,0.9199799778328389,0.8592450893855889, Japan ,2020,4,15,5,2
721,Attending a school talent show to support classmates. Applauding the diverse talents on display! ,0, #TalentShow #HighSchoolEntertainment ,-0.355446809617233,-0.3481223329624538, Canada,2023,10,18,16,139
676,Attempting to impress the teacher with an elaborate science experiment. Science geek mode: Activated! ,2, #ScienceGeek #HighSchoolExperiments ,0.21140954036057674,0.07800734551332597, UK,2023,9,3,22,110
659,Hosting a sleepover with friends this weekend. Preparing for a night of laughter and memories! ,2, #SleepoverFun #HighSchoolMemories ,-0.4971608971116855,-0.5611871722003436, UK,2023,8,17,22,110
625,"Started a community garden, growing not just plants but friendships too. Green thumbs unite! #CommunityGarden #SeniorGardener ",2, #GardenFriends #SeniorGreenThumb ,0.9199799778328389,0.8592450893855889, Canada,2023,7,3,12,172
618,"Attended a lecture on history, always fascinated by the lessons from the past. Learning is a lifelong adventure. #HistoryLecture #SeniorLearning ",1, #LifetimeAdventure #SeniorCuriosity ,1.2034081528217437,1.214353154782072, UK,2023,6,26,14,64
557,"Experiencing a series of losses in the basketball season, the team grapples with frustration, determined to turn the tide with renewed effort. ",2, #RenewedEffort #BasketballStruggles ,0.06969545286612429,0.1490289585926226, Canada ,2019,2,12,19,230
578,"In the realm of fashion, the designer unveils a collection that tells a story, blending innovation and tradition on the runway of creativity. ",1, #RunwayCreativity #FashionInnovation ,0.9199799778328389,0.8592450893855889, Italy ,2015,11,10,21,238
86, Admiring the dedication of volunteers at a local charity. ,3, #Admiration #Volunteers                     ,-0.2137327221227806,-0.20607910680386055, USA        ,2023,2,24,11,4
243," Embracing the beauty in imperfections, finding acceptance in the mosaic of life's unpredictable art. ",0, #Acceptance #UnpredictableArt            ,-0.4971608971116855,-0.49016555912104703, Australia    ,2023,6,15,16,1
160, Enthusiasm for a DIY home improvement project.       ,0, #Enthusiasm #HomeImprovement                 ,-0.9223031595950428,-0.9162952375968269, Australia   ,2018,4,15,16,102
525,"In the audience of a Jay-Z performance, the lyrics of 'Empire State of Mind' become an anthem of pride. ",2, #Pride #JayZAnthem ,-0.4971608971116855,-0.5611871722003436, USA ,2017,9,10,20,217
36, Quality time with family this weekend.             ,0, #FamilyTime #Weekend                    ,0.06969545286612429,0.1490289585926226, UK        ,2023,1,26,17,214
541,"Celebrating a historic victory in the World Cup, the nation erupts in joy, united by the triumph of their football team. ",1, #Joy #WorldCupTriumph ,2.6205490277662684,2.6347854163680045, Brazil ,2018,7,15,21,172
171," Anxiety grips my heart, worry clouds my thoughts.  ",1, #Anxiety #Worry                               ,-1.3474454220784002,-1.27140330299331, UK           ,2019,4,15,9,19
627,"Enrolled in a dance class for seniors, moving to the rhythm of life. Age is just a number on the dance floor. #DanceClass #SeniorDancer ",2, #DanceLife #SeniorMoves ,-0.4971608971116855,-0.5611871722003436, UK,2023,7,5,20,172
619,"Rediscovered the joy of cooking traditional family recipes. The kitchen, a place of cherished memories. #FamilyRecipes #SeniorCooking ",2, #KitchenMemories #SeniorCulinary ,-0.2137327221227806,-0.20607910680386055, USA,2023,6,27,17,56
688,Witnessed a heated argument in the cafeteria. Unpleasant atmosphere at lunch. ,1, #CafeteriaDrama #HighSchoolTension ,-0.07201863462832815,-0.1350574937245639, Canada,2023,9,15,14,143
96, Confusion reigns as I try to make sense of recent events.,1, #Confusion #MakingSense                    ,0.4948377153494816,0.5041370239891058, UK   ,2023,2,27,14,52
564,"Exploring the vibrant street art of a cultural neighborhood, each mural tells a story, infusing the city with creativity and expression. ",1, #Creativity #StreetArtVibes ,0.06969545286612429,0.1490289585926226, Brazil ,2017,11,5,21,60
241," Leafing through the pages of an old photo album, nostalgia weaving tales of laughter and tears. ",3, #Nostalgia #PhotoAlbumStories            ,-1.3474454220784002,-1.27140330299331, USA          ,2017,5,18,14,201
575,"Surrounded by the vibrant colors of a flower garden, the gardener nurtures blossoms, finding joy in the beauty of nature's ever-changing canvas. ",1, #NaturesBeauty #FloralJoy ,0.9199799778328389,0.8592450893855889, Australia ,2020,5,15,18,194
461,"In the void of heartache, echoes of a love song play, each note a pang of longing. ",1, #Heartache #LoveSongLonging ,1.2034081528217437,1.214353154782072, Japan ,2022,7,10,22,144
554,"In the midst of a cycling race, a tire blowout leads to frustration for the cyclist, who valiantly tries to overcome the unexpected obstacle. ",2, #Obstacle #CyclingFrustration ,0.06969545286612429,0.1490289585926226, France ,2017,5,15,22,204
642,"Participated in a charity run, proving that age is no barrier to supporting meaningful causes. #CharityRun #SeniorRunner ",2, #RunForACause #SeniorSupport ,1.2034081528217437,1.214353154782072, Canada,2023,7,20,17,110
207," Curiosity leading me down the rabbit hole of knowledge, a perpetual student in life's classroom. ",1, #Curiosity #KnowledgeQuest                ,-0.2137327221227806,-0.20607910680386055, USA          ,2022,10,8,8,68
393,Joyful laughter resonates through a lively summer carnival.         ,0, #FestiveJoy #SummerCarnival             ,0.06969545286612429,0.1490289585926226, Japan            ,2020,12,15,15,117
398,Reflective contemplation amid the ruins of a forgotten era.        ,3, #Reflection #ForgottenEra               ,-0.4971608971116855,-0.5611871722003436, Greece           ,2023,4,18,17,224
620,"Joined a nature photography club, capturing the beauty of the great outdoors. Every click is a connection to nature. #NaturePhotography #SeniorPhotographer ",0, #OutdoorBeauty #SeniorClicks ,-0.4971608971116855,-0.5611871722003436, UK,2023,6,28,22,172
218," Drifting through the day with a nonchalant demeanor, embracing the art of indifference. ",3, #Indifference #DriftingThroughLife       ,-1.7725876845617574,-1.7685545945483863, UK            ,2023,2,10,17,158
4, Trying out a new recipe for dinner tonight.        ,1, #Cooking #Food                           ,-1.3474454220784002,-1.27140330299331, Australia ,2023,1,15,19,197
653,Successfully organized a surprise birthday party for a friend. Party planning expert mode: Achieved! ,2, #BirthdayParty #HighSchoolCelebration ,0.06969545286612429,0.1490289585926226, Canada,2023,8,11,18,172
613,"Exploring the art of meditation, finding tranquility in the stillness of the mind. #MeditationJourney #TranquilMind ",2, #MindfulLiving #SeniorCalm ,-0.4971608971116855,-0.5611871722003436, UK,2023,6,21,19,56
547,"At the golf tournament, the golfer's precision and focus lead to a stunning victory, leaving spectators in awe of their exceptional skill. ",1, #Awe #GolfVictory ,0.06969545286612429,0.1490289585926226, Scotland ,2016,4,10,18,24
99, Pride in completing a challenging fitness challenge.    ,1, #Pride #FitnessChallengeCompleted          ,1.2034081528217437,1.214353154782072, UK            ,2023,2,28,16,218
574,"Amidst the pages of a captivating mystery novel, the reader unravels clues and secrets, experiencing a thrilling journey of suspense and revelation. ",2, #ThrillingJourney #MysteryNovel ,0.06969545286612429,0.1490289585926226, UK ,2017,4,10,21,265
407,Heartfelt gratitude for the laughter shared during a family reunion. ,0, #Gratitude #FamilyLaughter              ,0.06969545286612429,0.1490289585926226, Austria         ,2017,12,28,19,129
503,"Sailing the azure waters of the Maldives, each wave a whisper of serenity in paradise. ",0, #Serenity #ParadiseWhispers ,0.06969545286612429,0.1490289585926226, Maldives ,2019,10,28,14,243
48, Reflecting on the beauty of nature.                ,0, #Nature #Reflection                     ,-0.9223031595950428,-0.9162952375968269, Australia ,2023,1,31,10,214
33, Coding a new project with enthusiasm.              ,0, #Coding #Enthusiasm                   ,1.2034081528217437,1.214353154782072, USA ,2023,1,25,13,214
201," Gazing at the sunset, a melancholic longing for moments that slip through the fingers of time. ",1, #Melancholy #SunsetMoments                 ,-1.3474454220784002,-1.27140330299331, Australia     ,2019,6,18,20,187
135, Reverence for the artistry displayed in a museum.      ,1, #Reverence #ArtAppreciation                  ,-0.4971608971116855,-0.5611871722003436, UK        ,2020,11,11,15,235
28, Quiet evening with a good book.                    ,1, #Reading #QuietTime                     ,-0.9223031595950428,-0.9162952375968269, Australia ,2023,1,23,19,214
644,Exploring the world of coding. Debugging is an adventure on its own! #CodingJourney #HighSchoolCoder ,2, #CodingAdventure #HighSchoolCoderLife ,0.4948377153494816,0.5041370239891058, UK,2023,8,2,14,110
231," A journey into the past, flipping through the pages of an old diary, nostalgia taking the lead. ",0, #Nostalgia #DiaryJourney                 ,-1.3474454220784002,-1.27140330299331, Canada        ,2018,8,10,15,201
490,"In the carnival of emotions, the rollercoaster of thrill sends the heart on a wild ride. ",1, #Thrill #WildHeartRide ,1.911978590294006,1.9245692855750383, South Africa ,2019,3,28,15,262
379,Embracing the thrill of speed on a rollercoaster's exhilarating twists. ,0, #Thrill #RollercoasterAdventure        ,0.06969545286612429,0.1490289585926226, Germany         ,2020,7,25,12,263
289," Hopeful whispers of wind, carrying the promises of a brighter tomorrow, a symphony of optimism in the air of possibilities. ",2, #Hopeful #BrighterTomorrows ,-0.9223031595950428,-0.9162952375968269, India ,2023,5,6,7,152
419,Marveling at the kaleidoscope of colors in a vibrant street market. ,1, #Marvel #ColorfulStreetMarket          ,0.06969545286612429,0.1490289585926226, Brazil          ,2015,8,22,15,185
392,Immersed in the enchanting melodies of a street musician's violin. ,3, #Melodic #StreetMusic                   ,-0.4971608971116855,-0.5611871722003436, France           ,2019,4,5,17,188
593,Caught up on the latest fashion trends and now planning a shopping spree. #Fashionista #TrendyTeen ,2, #FashionGoals #TeenStyle ,-0.2137327221227806,-0.20607910680386055, USA,2023,6,1,18,110
499,"Embarking on a gondola ride in Venice, each canal reflecting the romance of this timeless city. ",1, #Romance #TimelessCity ,-0.2137327221227806,-0.20607910680386055, Italy ,2019,4,18,16,236
139, Contentment in the simplicity of a home-cooked meal. ,0, #Contentment #HomeCooking                     ,0.4948377153494816,0.5041370239891058, India    ,2015,9,12,13,57
63, Sending affectionate vibes to all my followers!          ,1, #Affection #PositiveVibes                   ,-0.9223031595950428,-0.9162952375968269,USA,2023,2,15,16,9
472,"Laughter echoes in the air, a chorus of happiness that lifts the spirit higher. ",2, #Happiness #SpiritLifter ,1.911978590294006,1.9245692855750383, Canada ,2018,4,12,18,136
129, Empowerment through learning and personal growth.      ,1, #Empowerment #PersonalGrowth                  ,0.4948377153494816,0.5041370239891058,USA,2014,7,20,11,95
712,Attending a school assembly to stay informed about upcoming events and announcements. Staying connected with school activities. ,2, #SchoolEvents #HighSchoolConnectivity ,-0.2137327221227806,-0.20607910680386055, Canada,2023,10,9,22,196
521,"At a Justin Bieber concert, the infectious beats of 'Baby' create a dance floor of unbridled enthusiasm. ",1, #Enthusiasm #JustinBieber ,2.6205490277662684,2.6347854163680045, Canada ,2018,8,5,20,101
65, Disappointed with the service at a local restaurant.    ,3, #Disappointed #BadService                   ,-0.4971608971116855,-0.5611871722003436, India      ,2023,2,16,9,80
14, Technology is changing the way we live.            ,3, #Tech #Innovation                       ,-0.9223031595950428,-0.9162952375968269, India    ,2023,1,19,9,197
157, Compassion in volunteering for a local charity.       ,0, #Compassion #VolunteerWork                   ,-0.4971608971116855,-0.5611871722003436, USA      ,2015,12,18,14,47
41, Planning a garden makeover for spring.             ,3, #Gardening #Spring                     ,0.4948377153494816,0.5041370239891058, USA      ,2023,1,28,14,214
493,"Exploring the wonders of Ferrari World, the roar of engines creating a symphony of speed. ",0, #Excitement #SymphonyOfSpeed ,0.06969545286612429,0.1490289585926226, Italy ,2019,11,10,14,110
380,Harmony resonates as musicians play a melody of unity and togetherness. ,1, #Harmony #MusicalUnity                   ,1.911978590294006,1.9245692855750383, Sweden          ,2019,11,30,19,141
188, Regret for decisions that led to a painful present.,3, #Regret #PastChoices                        ,-1.3474454220784002,-1.27140330299331, USA          ,2018,12,15,16,227
217," Exploring new horizons with the spark of curiosity, an adventurer in the vast landscape of knowledge. ",0, #Curiosity #NewHorizons                  ,0.06969545286612429,0.1490289585926226, India         ,2022,4,15,8,68
53, Can't believe the injustice happening in our society.,3, #Injustice #Angry                            ,-0.2137327221227806,-0.20607910680386055, Canada     ,2023,2,11,9,15
338,Overwhelmed by the support received during a personal challenge.,0, #Overwhelmed #SupportiveCommunity          ,0.4948377153494816,0.5041370239891058, USA               ,2021,5,20,17,209
296," A playful escapade in the carnival of life, carousel laughter and cotton candy dreams swirling in the joyous atmosphere. ",0, #Playful #CarnivalEscapade ,0.35312362785502915,0.3620937978305125, Australia ,2018,8,22,17,211
252," A heart overflowing with gratitude, a garden where appreciation blooms in the soil of kindness and connection. ",0, #Grateful #BlossomingConnection ,-0.2137327221227806,-0.20607910680386055, USA ,2023,2,28,9,127
462,"Nostalgia, a bittersweet dance in the moonlit ballroom of cherished memories. ",2, #Nostalgia #CherishedMemories ,-0.4971608971116855,-0.5611871722003436, Italy ,2019,5,15,21,198
456,"Tears, the currency of grief, spent in the marketplace of lost love and longing. ",0, #Grief #LostLoveLonging ,0.4948377153494816,0.5041370239891058, USA ,2016,12,22,21,133
730,Successfully fundraising for a school charity initiative. The joy of giving back to the community! ,2, #CommunityGiving #HighSchoolPhilanthropy ,0.06969545286612429,-0.06403588064526729, Canada,2019,4,5,17,139
270," Navigating the river of contentment, a serene boat cruise through the tranquil waters of inner peace and acceptance. ",1, #Contentment #TranquilWaters ,-0.2137327221227806,-0.20607910680386055, Canada ,2019,4,27,9,56
202," Revisiting old photographs, caught in the embrace of nostalgia's bittersweet symphony. ",0, #Nostalgia #MemoryLane                     ,-1.630873597067305,-1.6265113683897932, USA          ,2018,2,5,15,201
162, Reverence for the wonders of nature on a hiking trail.,1, #Reverence #NatureExploration                ,-0.4971608971116855,-0.5611871722003436, USA        ,2020,5,11,15,234
556,"In the golf tournament, a missed crucial putt results in defeat, causing the golfer to reflect on the pressure of high-stakes competition. ",0, #Pressure #GolfDefeat ,-0.4971608971116855,-0.5611871722003436, USA ,2016,8,20,18,216
402,Radiant joy akin to blossoming flowers on a sunlit spring morning. ,0, #Radiance #SpringBlooms                 ,0.4948377153494816,0.5041370239891058, Netherlands     ,2022,5,5,10,222
477,"In the dance of positivity, every step is a rhythm, uplifting the soul in harmony. ",1, #Positivity #SoulUpliftment ,-0.4971608971116855,-0.5611871722003436, France ,2016,9,18,19,215
106, Excitement for a weekend road trip to explore new places. ,3, #Excitement #WeekendAdventure               ,0.4948377153494816,0.5041370239891058, India     ,2023,3,2,16,110
566,"Connecting with the melody of a live orchestra, the music enthusiast experiences a symphony that resonates deep within the soul. ",0, #Harmony #OrchestraMelody ,-0.4971608971116855,-0.5611871722003436, UK ,2016,8,22,19,140
