Unnamed: 0.1,Text,Platform,Hashtags,Retweets,Likes,Country,Year,Month,Day,Hour,Sentiment
191," Grief overwhelms, a storm of emotions within.      ",3, #Grief #EmotionalStorm                      ,-1.3474454220784002,-1.27140330299331, Canada        ,2021,2,25,15,135
645,"Joined the school debate team. Words are my weapons, and I'm ready for battle! ",0, #DebateWarrior #HighSchoolDebater ,-0.4971608971116855,-0.5611871722003436, Canada,2023,8,3,12,110
694,Missing an important event due to unforeseen circumstances. A day filled with sadness. ,1, #MissedChances #HighSchoolRegret ,-0.2137327221227806,-0.27710071988315715, Canada,2023,9,21,16,239
631,"Participated in a local theater production, proving that the stage belongs to every age. #TheaterProduction #SeniorActor ",0, #StagePassion #SeniorTheater ,-0.2137327221227806,-0.20607910680386055, USA,2023,7,9,22,172
95, Finding calmness amidst the chaos of daily life.        ,3, #Calmness #InnerPeace                      ,-0.9223031595950428,-0.9162952375968269, India     ,2023,2,27,9,38
181," Resentment festers, poisoning relationships.       ",0, #Resentment #BrokenTrust                     ,-1.630873597067305,-1.6265113683897932, Australia    ,2022,1,15,12,231
302," Apprehensive steps on the tightrope of uncertainty, a balancing act where the fall seems inevitable, anxiety a constant companion. ",2, #Apprehensive #BalancingAct ,-1.0640172470894953,-1.05833846375542, UK ,2023,4,8,13,21
479,"Draped in the warmth of kindness, a quilt of compassion stitched with love. ",0, #Kindness #LoveStitches ,0.4948377153494816,0.5041370239891058, Brazil ,2019,5,5,12,177
539,"Binge-watching a thrilling crime series, the suspense keeps the viewer on the edge of their seat, creating a rush of adrenaline. ",0, #Suspense #CrimeSeriesThrills ,1.911978590294006,1.9245692855750383, Japan ,2015,7,12,22,259
560,"In the midst of a soccer match, an unexpected own goal creates a moment of despair for the player, as teammates console and encourage them. ",2, #Despair #OwnGoal ,0.06969545286612429,0.1490289585926226, Spain ,2018,12,15,20,72
690,Dealing with a personal setback. Sometimes life throws unexpected challenges. ,2, #LifeChallenges #HighSchoolStruggles ,0.06969545286612429,0.07800734551332597, USA,2023,9,17,20,239
646,"Started a photography club at school. Capturing moments, one snapshot at a time! ",1, #PhotographyClub #HighSchoolPhotographer ,0.06969545286612429,0.1490289585926226, USA,2023,8,4,16,172
481,"In the embrace of love, each heartbeat is a melody, dancing to the rhythm of affection. ",2, #Love #RhythmOfAffection ,1.911978590294006,1.9245692855750383, USA ,2022,11,15,20,183
5, Feeling grateful for the little things in life.    ,3, #Gratitude #PositiveVibes              ,0.4948377153494816,0.5041370239891058, India    ,2023,1,16,9,214
718,Participating in a debate club to enhance critical thinking and communication skills. Intellectual engagement in progress. ,2, #DebateSkills #HighSchoolIntellect ,0.06969545286612429,0.006985732434029342, Canada,2023,10,15,20,196
46, New book release from my favorite author!          ,1, #BookRelease #FavoriteAuthor           ,-1.3474454220784002,-1.27140330299331, UK   ,2023,1,30,15,214
448,"Tears, the ink staining the pages of a journal, a testament to silent grief. ",1, #Grief #SilentTears ,1.2034081528217437,1.214353154782072, India ,2023,1,28,14,133
553,"Facing a defeat in the championship, the boxer reflects on the challenges, vowing to return stronger and more determined in the next bout. ",0, #Reflection #BoxingDefeat ,1.2034081528217437,1.214353154782072, UK ,2020,9,18,19,223
172, Intimidation by the unknown future ahead.          ,0, #Intimidation #Fear                           ,-0.9223031595950428,-0.9162952375968269, India        ,2021,12,3,18,165
16, Just adopted a cute furry friend! 🐾              ,1, #PetAdoption #FurryFriend               ,-0.9223031595950428,-0.9162952375968269, Canada    ,2023,1,19,17,214
49, Cooking a special dinner for loved ones.           ,1, #Cooking #SpecialDinner                ,-0.2137327221227806,-0.20607910680386055, USA       ,2023,1,31,19,214
708,Experimenting with a new recipe for a school bake sale. Baking adventures in the kitchen. ,1, #BakingAdventures #HighSchoolBakes ,-0.07201863462832815,0.006985732434029342, USA,2023,10,5,14,196
670,Perfecting the art of creating origami during a dull lecture. Origami mastery: A+! ,2, #OrigamiMaster #HighSchoolArt ,-0.4971608971116855,-0.49016555912104703, USA,2023,8,28,16,172
3, Excited about the upcoming weekend getaway!        ,0, #Travel #Adventure                       ,-1.9143017720562099,-1.9816194337862763, UK       ,2023,1,15,18,214
508,"Skiing down the slopes of the Swiss Alps, each turn a dance with the majesty of snow-capped peaks. ",2, #Adventure #SnowPeakDance ,0.06969545286612429,0.1490289585926226, Switzerland ,2019,1,10,14,8
463,"In the symphony of grief, each tear is a note, composing a melancholic melody. ",0, #Grief #MelancholicMelody ,0.06969545286612429,0.1490289585926226, Germany ,2018,11,28,14,133
317," Envious gazes cast upon the podium of success, a bitter pill swallowed, the taste lingering as a constant reminder of unattained heights. ",2, #Envious #BitterPill ,-0.2137327221227806,-0.20607910680386055, USA ,2021,2,10,19,103
674,Practicing a stand-up comedy routine for the upcoming talent show. Comedy gig: In the making! ,1, #StandUpComedy #HighSchoolTalent ,-0.07201863462832815,-0.27710071988315715, Canada,2023,9,1,14,172
284," Navigating the river of contentment, a serene boat cruise through the tranquil waters of inner peace and acceptance. ",1, #Contentment #TranquilWaters ,-0.2137327221227806,-0.20607910680386055, Canada ,2019,4,27,9,56
97, Excitement building up for a surprise birthday party.   ,0, #Excitement #SurpriseParty                 ,0.06969545286612429,0.1490289585926226, Canada ,2023,2,27,18,111
286," A free spirit soaring on the wings of dreams, leaving trails of independence in the azure sky of boundless possibilities. ",2, #FreeSpirit #WingsOfDreams ,0.06969545286612429,0.07800734551332597, UK ,2020,6,10,10,118
531,"Captivated by the spellbinding plot twists, the audience applauds, experiencing a rollercoaster of emotions at the movie premiere. ",2, #Excitement #MoviePremiereThrills ,2.6205490277662684,2.6347854163680045, USA ,2018,10,12,20,110
226," Basking in the serenity of a quiet forest, where the whispers of nature bring peace to the soul. ",0, #Serenity #NatureWhispers                ,0.4948377153494816,0.5041370239891058, USA          ,2020,2,28,18,246
27, Learning a new language for personal growth.       ,0, #LanguageLearning #PersonalGrowth       ,0.4948377153494816,0.5041370239891058, India     ,2023,1,23,16,214
604,"Reflecting on a lifetime of memories, each wrinkle tells a story. Embracing the beauty of aging. #LifeReflections #BeautyInAging ",2, #AgingGracefully #Memories ,0.9199799778328389,0.8592450893855889, UK,2023,6,12,18,128
264," With a zestful heart, sprinting through fields of enthusiasm, chasing sunbeams and laughter in the meadows of joy. ",1, #Zest #FieldsOfEnthusiasm ,-0.7805890721005904,-0.7742520114382335, India ,2023,3,30,16,278
438,"Darkness descends, engulfing the soul in the shadows of despair.  ",0, #Darkness #SoulEngulfed                 ,0.9199799778328389,0.8592450893855889, USA         ,2016,7,10,18,69
51, Starting a new fitness challenge tomorrow! 💪     ,0, #FitnessChallenge #NewBeginnings       ,0.06969545286612429,0.1490289585926226, UK         ,2023,2,1,8,214
365,Wonderment at the beauty of a double rainbow after the rain.     ,3, #Wonderment #DoubleRainbow               ,1.911978590294006,1.9245692855750383, USA               ,2017,6,12,18,276
230," Melancholy painting the world in hues of nostalgia, a canvas of bittersweet memories. ",1, #Melancholy #BittersweetMemories         ,-1.2057313345839478,-1.2003816899140134, USA          ,2020,1,5,20,187
38, Practicing mindfulness with meditation.            ,3, #Mindfulness #Meditation               ,-0.9223031595950428,-0.9162952375968269, India    ,2023,1,27,12,214
158, Tenderness in a quiet moment shared with a pet.      ,3, #Tenderness #PetLove                          ,0.4948377153494816,0.5041370239891058, Canada   ,2016,2,10,19,261
238," Lost in the labyrinth of thoughts, confusion casting shadows on the quest for clarity. ",3, #Confusion #LabyrinthOfThoughts          ,-1.0640172470894953,-1.05833846375542, Australia    ,2020,6,5,12,53
703,Having a string of bad luck with constant technology malfunctions. Tech troubles galore! ,1, #TechIssues #HighSchoolTech ,0.06969545286612429,0.006985732434029342, Canada,2023,9,30,18,28
375,Chasing dreams like a kite soaring high in the vast open sky.      ,3, #DreamChaser #SkyHighDreams              ,1.2034081528217437,1.214353154782072, Australia         ,2021,2,28,13,86
371,Mesmerized by the cosmic dance of fireflies on a moonlit night.    ,1, #Enchantment #CosmicFireflies             ,0.4948377153494816,0.5041370239891058, Brazil           ,2022,8,10,22,97
443,"In the labyrinth of grief, the walls echo with the footsteps of lost joy. ",0, #Grief #LostJoyFootsteps ,-0.4971608971116855,-0.5611871722003436, USA ,2018,12,5,21,133
176, Disgust at the sight of injustice and cruelty.     ,3, #Disgust #Injustice                          ,-2.056015859550662,-1.9816194337862763, India        ,2019,2,11,9,84
622,"Joined a writing group, penning down thoughts and reflections. Writing, a journey into the depths of the soul. #WritingGroup #SeniorWriter ",2, #SoulfulWriting #SeniorReflections ,0.9199799778328389,0.8592450893855889, UK,2023,6,30,19,128
128, Hopeful about the possibilities of a new journey.      ,3, #Hope #NewBeginnings                          ,-0.4971608971116855,-0.5611871722003436, Canada    ,2013,12,5,16,151
596,Successfully cooked a gourmet meal for the family. Chef skills unlocked! #ChefMode #TeenChef ,2, #CookingSuccess #TeenCook ,0.4948377153494816,0.5041370239891058, USA,2023,6,4,19,217
195," Frustration escalates, a thunderstorm of emotions. ",1, #Frustration #EmotionalOutburst            ,-1.3474454220784002,-1.27140330299331, UK            ,2022,4,5,14,123
624,"Attended a vintage car show, reminiscing about the classics that once ruled the roads. Nostalgia in every rev. #VintageCars #ClassicRides ",0, #RoadTripDownMemoryLane #SeniorCars ,0.06969545286612429,0.1490289585926226, UK,2023,7,2,18,172
632,"Embarked on a hiking adventure, conquering trails and relishing the beauty of nature. Age is just a number on the mountaintop. #HikingAdventure #SeniorHiker ",1, #NatureTrailBlazer #SeniorExplorer ,0.9199799778328389,0.8592450893855889, UK,2023,7,10,14,110
661,Accidentally liked my crush's old photo while stalking their profile. Awkward level: Maximum! ,1, #SocialMediaBlunder #HighSchoolAwkward ,0.06969545286612429,0.1490289585926226, UK,2023,8,19,19,91
634,"Joined a seniors' cycling club, feeling the wind in my hair and the freedom of the open road. #CyclingClub #SeniorCyclist ",0, #OpenRoadAdventures #SeniorCycling ,0.4948377153494816,0.5041370239891058, USA,2023,7,12,13,110
502,"Captivated by the historical charm of the Colosseum, each stone echoing tales of gladiator valor. ",2, #Captivation #GladiatorTales ,0.4948377153494816,0.5041370239891058, Italy ,2018,3,15,17,40
707,Sharing favorite book recommendations with classmates. Building a mini book club. ,0, #BookClub #HighSchoolReads ,-0.355446809617233,-0.3481223329624538, UK,2023,10,4,18,196
610,"Reconnecting with old friends over a cup of tea. Friendship, the true essence of companionship. #OldFriends #Companionship ",2, #FriendshipGoals #SeniorBonding ,0.9199799778328389,0.8592450893855889, UK,2023,6,18,11,56
630,"Hosted a picnic in the park, basking in the warmth of friendship and sunshine. Simple joys, timeless memories. #ParkPicnic #SeniorJoy ",2, #FriendshipSunshine #SeniorMemories ,1.2034081528217437,1.214353154782072, Canada,2023,7,8,16,56
68, Overflowing with adoration for my adorable pet! 🐾      ,3, #Adoration #PetLove                         ,0.06969545286612429,0.1490289585926226, UK        ,2023,2,17,10,6
495,"Wandering through the historical streets of Kyoto, each step a journey into the heart of Japan's traditions. ",2, #Exploration #JapaneseTraditions ,-0.4971608971116855,-0.5611871722003436, Japan ,2017,8,22,21,114
169, Frustration mounts as obstacles block my path.     ,0, #Frustration #Obstacles                       ,-1.630873597067305,-1.6265113683897932, USA          ,2017,1,30,16,123
445,"The bitterness of betrayal, a taste that lingers, staining the palate of trust. ",1, #Bitterness #StainedTrust ,-0.9223031595950428,-0.9162952375968269, Germany ,2019,10,22,17,32
501,"In the heart of New York City, Times Square dazzles with lights, a vibrant spectacle of urban energy. ",1, #Excitement #UrbanEnergy ,1.911978590294006,1.9245692855750383, USA ,2022,7,20,21,110
163, Elation after a surprise reunion with a childhood friend.,0, #Elation #FriendshipReunion                  ,0.4948377153494816,0.5041370239891058, Canada      ,2021,2,5,9,88
310," Loneliness, a silent companion in the night, the only echo in the chamber of solitude, a heart's solitary nocturne. ",0, #Loneliness #SolitaryNocturne ,-0.4971608971116855,-0.49016555912104703, Australia ,2019,9,19,3,178
194," Resentment festers, a wound that refuses to heal.  ",3, #Resentment #Unforgiving                    ,-1.630873597067305,-1.6265113683897932, India         ,2017,1,12,12,231
523,"Immersed in the soulful melodies of Adele, tears flow freely, moved by the emotion of 'Hello'. ",0, #Emotion #AdeleMelodies ,1.2034081528217437,1.214353154782072, UK ,2019,11,28,19,92
366,Optimism for a bright future amidst challenging times.           ,1, #Optimism #BrightFuture                  ,-0.2137327221227806,-0.20607910680386055, Canada            ,2021,7,5,9,206
384,Rejuvenated by the salty breeze and the sound of waves at the seaside. ,3, #Rejuvenation #SeasideEscape            ,-0.4971608971116855,-0.5611871722003436, Spain           ,2021,9,20,14,228
660,"Spent hours on a TikTok dance, only to realize I have two left feet. Dance fail: Unleashed! ",0, #DanceFail #HighSchoolTikTok ,0.4948377153494816,0.5041370239891058, USA,2023,8,18,16,91
530,"Swaying to the reggae vibes of Bob Marley's tribute concert, each chord a journey to Jamaica's soul. ",1, #Journey #BobMarleyTribute ,1.2034081528217437,1.214353154782072, Jamaica ,2020,3,5,18,171
153, Serenity found in the beauty of a sunset by the sea.  ,1, #Serenity #SunsetViews                       ,0.06969545286612429,0.1490289585926226, Canada     ,2011,7,22,18,245
504,"In the midst of the Amazon rainforest, a symphony of wildlife creates an orchestra of nature's wonders. ",1, #Wonder #NatureOrchestra ,1.2034081528217437,1.214353154782072, Brazil ,2021,6,10,16,273
522,"In the spotlight at a Lady Gaga show, each costume change is a metamorphosis of creativity and artistry. ",2, #Creativity #LadyGaga ,1.911978590294006,1.9245692855750383, USA ,2021,4,15,21,60
112," Embracing the beauty of nature, a moment of contentment. ",0, #Contentment #Nature                           ,0.4948377153494816,0.5041370239891058, India       ,2011,6,20,14,57
227," Indifferent to the noise of the world, a silent observer in the midst of life's cacophony. ",1, #Indifference #SilentObserver            ,-1.7725876845617574,-1.7685545945483863, India         ,2023,3,10,16,158
513,"In the crowd of a Taylor Swift concert, the lyrics of 'Love Story' create an enchanting fairy tale. ",0, #Enchantment #TaylorSwift ,1.2034081528217437,1.214353154782072, USA ,2021,5,10,19,96
585,Decided to study for exams but ended up making memes about studying instead. Procrastination level: Expert. #ProcrastinationNation #TeenConfessions ,1, #StudyingMemes #TeenLife ,0.4948377153494816,0.5041370239891058, Canada,2023,5,24,13,256
104, Calmness prevails as I practice mindfulness.            ,0, #Calmness #Mindfulness                      ,-0.9223031595950428,-0.9162952375968269, UK        ,2023,3,2,18,38
422,Numbness sets in as the weight of loneliness grows heavier.       ,3, #Loneliness #HeavyHeart                  ,-0.4971608971116855,-0.5611871722003436, Canada          ,2021,2,12,16,179
420,Awash with serenity as the sun sets over a tranquil lakeside retreat. ,0, #Serenity #TranquilSunset              ,0.9199799778328389,0.8592450893855889, Germany       ,2020,11,20,18,244
572,"In the heart of a bustling market, the street food connoisseur indulges in a culinary adventure, savoring diverse flavors and aromas. ",1, #CulinaryAdventure #StreetFoodDelights ,1.911978590294006,1.9245692855750383, Thailand ,2019,8,28,19,62
555,"The gymnast's unexpected fall during a routine sparks a wave of sympathy from the audience, highlighting the vulnerability of sports. ",1, #Sympathy #GymnasticsFall ,0.9199799778328389,0.8592450893855889, Japan ,2021,4,5,20,260
75, Pride in achieving a personal milestone.               ,1, #Pride #Milestone                           ,1.2034081528217437,1.214353154782072, Australia    ,2023,2,19,16,218
116, Empowered to make a difference in my community.        ,3, #Empowerment #Community                        ,-0.9223031595950428,-0.9162952375968269, UK       ,2014,9,14,8,95
408,"Embarking on a culinary odyssey, savoring flavors around the world. ",3, #CulinaryOdyssey #FlavorsAroundTheWorld ,1.911978590294006,1.9245692855750383, Belgium         ,2019,3,2,20,63
706,Organizing a community cleanup event for a cleaner neighborhood. Promoting environmental awareness. ,2, #EnvironmentalEfforts #HighSchoolCommunity ,0.6365518028439341,0.5041370239891058, Canada,2023,10,3,12,196
120, Enthusiastically diving into a new project.            ,1, #Enthusiasm #NewProject                       ,-0.9223031595950428,-0.9162952375968269, USA  ,2018,6,15,16,102
54, Feeling a sense of fear after watching a thriller movie. ,1, #Fear #ThrillerMovie                         ,-0.9223031595950428,-0.9162952375968269, USA          ,2023,2,11,21,115
152, Contentment in the embrace of a loved one.           ,3, #Contentment #Love                             ,1.2034081528217437,1.214353154782072, India    ,2010,11,12,20,57
404,Rejuvenated by the salty breeze and the sound of waves at the seaside. ,3, #Rejuvenation #SeasideEscape            ,-0.4971608971116855,-0.5611871722003436, Spain           ,2021,9,20,14,228
689,Received a not-so-great grade on a major project. Academic frustration setting in. ,0, #AcademicFrustration #HighSchoolStress ,-0.355446809617233,-0.3481223329624538, UK,2023,9,16,17,28
208," Floating through the day with an air of indifference, detached from the mundane happenings around. ",0, #Indifference #FloatingThroughLife        ,-1.630873597067305,-1.6265113683897932, Canada        ,2023,3,22,16,158
514,"Rocking out to the guitar solos at a Queen tribute concert, a journey back in time with Freddie's spirit. ",1, #Nostalgia #QueenTribute ,0.06969545286612429,0.1490289585926226, UK ,2018,12,2,22,198
526,"Dancing to Shakira's rhythmic beats, hips swaying to the hypnotic charm of 'Hips Don't Lie'. ",0, #Hypnotic #ShakiraRhythms ,0.9199799778328389,0.8592450893855889, Colombia ,2022,2,28,21,153
617,"Embarking on a journey of writing a memoir, documenting a lifetime of experiences. Every story matters. #MemoirWriting #SeniorStories ",0, #LifetimeExperiences #SeniorMemoir ,1.911978590294006,1.9245692855750383, USA,2023,6,25,20,128
677,Crafting intricate friendship bracelets for the whole squad. Friendship level: Expert weaver! ,1, #FriendshipBracelets #HighSchoolCrafts ,-0.355446809617233,-0.4191439460417504, USA,2023,9,4,15,172
8, Political discussions heating up on the timeline.  ,3, #Politics #Debate                       ,1.2034081528217437,1.214353154782072, USA      ,2023,1,17,8,195
611,"Embarked on a road trip to revisit cherished places from the past. Nostalgia, the ultimate travel companion. #RoadTrip #NostalgiaTour ",0, #CherishedPlaces #SeniorTravel ,0.06969545286612429,0.1490289585926226, Canada,2023,6,19,16,172
507,"Exploring the ancient ruins of Angkor Wat, each stone whispering stories of Khmer civilization. ",1, #Exploration #KhmerStories ,-0.2137327221227806,-0.20607910680386055, Cambodia ,2016,11,22,13,114
633,Hosted a photography exhibition featuring snapshots of a life well-lived. Every photo has a story to tell. #PhotographyExhibition #SeniorPhotographer ,2, #LifeInPictures #SeniorExhibition ,0.06969545286612429,0.1490289585926226, Canada,2023,7,11,18,128
37, Attending a live music concert tonight.            ,1, #Music #ConcertNight                  ,-0.4971608971116855,-0.5611871722003436, USA ,2023,1,27,20,214
453,"In the labyrinth of despair, the echoes of a broken heart reverberate endlessly. ",0, #Despair #EndlessReverberation ,0.9199799778328389,0.8592450893855889, Australia ,2017,3,28,22,72
140, Serenity found in the melody of a peaceful piano.    ,3, #Serenity #PeacefulMelody                    ,-0.4971608971116855,-0.5611871722003436, Canada      ,2016,7,30,18,245
254," Compassionate clouds, heavy with care, showering empathy on the parched grounds of human suffering. ",2, #Compassionate #ShowerOfEmpathy ,-0.4971608971116855,-0.49016555912104703, Australia ,2022,6,20,10,48
304," Jealousy, a green-eyed monster, lurking in the shadows, casting a dark cloud over the sunshine of others' success. ",0, #Jealous #GreenEyedMonster ,-0.7805890721005904,-0.7742520114382335, USA ,2019,8,30,10,168
606,Savoring the flavors of a home-cooked meal. Simple joys are the heart of happiness. #HomeCooking #SimpleJoys ,1, #HappinessInFood #SeniorLife ,0.4948377153494816,0.5041370239891058, USA,2023,6,14,19,56
528,"Rocking out at a Guns N' Roses show, the iconic riffs of 'Sweet Child o' Mine' echoing in the night. ",2, #Iconic #GNRConcert ,0.06969545286612429,0.1490289585926226, USA ,2018,12,10,22,154
536,"At the Oscars, the actor graciously accepts an award, radiating joy and gratitude for the recognition of their outstanding performance. ",0, #Gratitude #OscarWinningMoment ,-0.4971608971116855,-0.5611871722003436, USA ,2016,2,28,20,128
263," Gratitude as a guiding star, navigating the constellation of blessings in the vast universe of life's precious moments. ",2, #Grateful #GuidingStar ,-0.355446809617233,-0.3481223329624538, Australia ,2022,3,12,19,127
298," Bitterness festering like a venomous vine, entwining the soul in a web of resentment, poisoning the garden of peace. ",0, #Bitterness #ResentmentWeb ,-1.3474454220784002,-1.3424249160726065, UK ,2019,3,8,14,32
415,"Lost in the pages of a captivating novel, transported to another world. ",3, #Immersion #CaptivatingNovel           ,-0.2137327221227806,-0.20607910680386055, UK              ,2019,9,28,19,156
151, The euphoria of a successful product launch.         ,0, #Euphoria #ProductLaunchSuccess              ,-0.9223031595950428,-0.9162952375968269, USA       ,2022,4,3,11,109
581,Successfully avoided eye contact with my crush in the hallway. Mission accomplished. #TeenCrush #StealthMode ,2, #CrushStruggles #AvoidingEyeContact ,-0.9223031595950428,-0.9162952375968269, USA,2023,5,20,19,110
650,Trying to master the perfect kickflip on my skateboard. Skating into the weekend like a pro! ,2, #SkaterLife #HighSchoolSkater ,1.2034081528217437,1.214353154782072, Canada,2023,8,8,16,110
489,"A symphony of laughter, each note a key to unlocking the door of boundless happiness. ",0, #Happiness #BoundlessLaughter ,1.2034081528217437,1.214353154782072, Brazil ,2021,8,2,19,136
148, Feeling a sense of fulfillment after helping others. ,0, #Fulfillment #HelpingOthers                  ,0.06969545286612429,0.1490289585926226, Canada    ,2011,8,28,18,125
147, Enthusiasm for a new artistic project in the works.  ,1, #Enthusiasm #ArtisticProject                 ,-0.9223031595950428,-0.9162952375968269, USA       ,2020,9,17,16,102
537,"Discovering a hidden gem in the world of documentaries, the viewer is enlightened and inspired, feeling a renewed sense of curiosity. ",2, #Inspiration #HiddenGemDiscovery ,0.06969545286612429,0.1490289585926226, France ,2022,4,20,17,160
678,Attempting to beat the record for the most consecutive cartwheels. Cartwheel challenge: Underway! ,2, #CartwheelChallenge #HighSchoolAthlete ,0.7782658903383866,0.646180250147699, Canada,2023,9,5,12,110
550,"Witnessing a heartwarming comeback in the hockey finals, fans share tears of joy as the team secures a historic victory after adversity. ",1, #Heartwarming #HockeyFinalsComeback ,0.06969545286612429,0.1490289585926226, Canada ,2020,12,12,20,147
349,Amused by the antics of playful kittens during playtime.           ,0, #Amusement #PlayfulKittens               ,-0.9223031595950428,-0.9162952375968269, Canada            ,2022,10,22,12,14
464,"Betrayal, a venomous serpent slithering through the garden of trust, poisoning roots. ",1, #Betrayal #PoisonedTrust ,0.4948377153494816,0.5041370239891058, Canada ,2021,3,2,17,29
326," Jealousy, a festering wound, the pain intensifying with each glance at the garden of others' achievements, blooming beyond the fence. ",2, #Jealous #BloomingAchievements ,-0.7805890721005904,-0.7742520114382335, UK ,2018,3,17,14,168
187," Envy poisons my thoughts, coveting others' success.",0, #Envy #Success                              ,-1.630873597067305,-1.6265113683897932, Canada        ,2017,3,20,11,105
124, The euphoria of a live music concert under the stars.  ,0, #Euphoria #LiveMusic                          ,-0.9223031595950428,-0.9162952375968269, USA ,2021,6,19,14,109
623,"Embarked on a solo travel adventure, discovering the beauty of new places at my own pace. #SoloTravel #SeniorExplorer ",1, #DiscoverNewPlaces #SeniorTravel ,1.2034081528217437,1.214353154782072, USA,2023,7,1,14,110
144, Compassion shown through acts of kindness in the community.,1, #Compassion #CommunityKindness               ,-0.4971608971116855,-0.5611871722003436, Australia ,2019,1,15,14,46
